concept_id,"name","description",question_count,participant_count,order_number
765936,"COPE Minute Survey","Survey includes information regarding a participant’s COVID-19 vaccination experience.",141,101440,8
1333342,"COVID-19 Participant Experience (COPE)","Survey includes information about the impact of COVID-19 on participant mental and physical health.",191,100320,7
1585710,"Overall Health","Survey includes information about how participants report levels of individual health.",21,372380,2
1585855,"Lifestyle","Survey includes information on participant smoking, alcohol and recreational drug use.",26,372380,3
1586134,"The Basics","This survey includes participant demographic information.",28,372380,1
1740639,"Personal and Family Health History","Survey includes information about the medical history of a participant and their immediate family members.",104,145620,6
40192389,"Social Determinants of Health","Survey includes information about the social determinants of health, including a participant’s neighborhood, social life, stress, and feelings about everyday life.",80,57620,9
43528895,"Health Care Access & Utilization","Survey includes information about a participant’s access to and use of health care.",57,160880,5
